{
  "schema_version": "1.0",
  "candidate_id": "candidate_synthetic",
  "run_id": "run_synthetic",
  "revision": 1,
  "name": {
    "value": "synthetic_protein",
    "source": "fasta_header",
    "evidence": "h1"
  },
  "sequence_spans": [
    {
      "block_id": "p1",
      "start": 0,
      "end": 20,
      "order": 1
    }
  ],
  "raw_text": "ACDEFGHIKLMNPQRSTVWY",
  "normalized_sequence": "ACDEFGHIKLMNPQRSTVWY",
  "type": "protein",
  "completeness": "complete",
  "status": "NEEDS_REVIEW",
  "origin": "extracted",
  "transformation_log": [],
  "issues": [],
  "qc_version": "1.0"
}
